{
  "$id": "urn:oneshot:schema:research_bundle:2",
  "$schema": "https://json-schema.org/draft/2020-12/schema",
  "additionalProperties": false,
  "properties": {
    "prompt_id": {
      "minLength": 1,
      "type": "string"
    },
    "prompt": {
      "$ref": "urn:oneshot:schema:prompt:2"
    },
    "researcher": {
      "$ref": "urn:oneshot:schema:researcher:2"
    },
    "plan": {
      "$ref": "urn:oneshot:schema:plan:2"
    },
    "schema_artifact": {
      "$ref": "urn:oneshot:schema:schema-artifact:2"
    },
    "fixture": {
      "$ref": "urn:oneshot:schema:fixture:2"
    },
    "goal": {
      "$ref": "urn:oneshot:schema:goal:2"
    },
    "validation": {
      "$ref": "urn:oneshot:schema:validation:2"
    }
  },
  "required": [
    "prompt",
    "researcher",
    "plan",
    "schema_artifact",
    "fixture",
    "goal",
    "validation"
  ],
  "type": "object"
}
