{
  "prompt_id": "prompt:planner-stage-architecture",
  "prompt": {
    "prompt_id": "prompt:planner-stage-architecture",
    "intent": "Research structure, audit findings contract, and execution design for next step: Planner stage",
    "requested_outcome": "Production-ready build plan for Planner agent with Strands/Tavily capability and Refactor loop integration",
    "context": [
      {
        "context_id": "ctx:planner-scope",
        "statement": "Planner audits ResearchBundle across 11 canonical areas and emits urn:oneshot:schema:audit:2 for Refactor."
      }
    ],
    "research_direction": [
      "planner audit findings schema",
      "dependency graph validation DAG",
      "strands model capability planning",
      "refactor handoff canonical transition"
    ]
  },
  "researcher": {
    "researcher_id": "researcher:planner-build-001",
    "prompt_id": "prompt:planner-stage-architecture",
    "plan_id": "plan:planner-build-001",
    "schema_id": "schema:planner-build-001",
    "fixture_id": "fixture:planner-build-001",
    "goal_id": "goal:planner-build-001",
    "validation_id": "validation:planner-build-001",
    "requirement_ids": [
      "req:planner-build-001:1",
      "req:planner-build-001:2",
      "req:planner-build-001:3",
      "req:planner-build-001:4"
    ],
    "evidence": [
      {
        "evidence_id": "evidence:planner-build-001:model",
        "source": "capability:function",
        "statement": "Planner audit architecture with graph-based validation, 11 review areas, and typed AuditFinding payload.",
        "provenance": "custom-function"
      },
      {
        "evidence_id": "evidence:planner-build-001:1",
        "source": "prompt:prompt:planner-stage-architecture",
        "statement": "Intent: Research structure, audit findings contract, and execution design for next step: Planner stage\nRequested outcome: Production-ready build plan for Planner agent with Strands/Tavily capability and Refactor loop integration",
        "provenance": "user-prompt"
      },
      {
        "evidence_id": "evidence:planner-build-001:2",
        "source": "prompt-context:ctx:planner-scope",
        "statement": "Planner audits ResearchBundle across 11 canonical areas and emits urn:oneshot:schema:audit:2 for Refactor.",
        "provenance": "user-prompt-context"
      },
      {
        "evidence_id": "evidence:planner-build-001:3",
        "source": "integration:tavily",
        "statement": "Tavily search and extract capability configured",
        "provenance": "app/integration/tavily"
      },
      {
        "evidence_id": "evidence:planner-build-001:4",
        "source": "integration:strands",
        "statement": "Strands Agent SDK orchestration configured",
        "provenance": "app/integration/strands"
      },
      {
        "evidence_id": "evidence:planner-build-001:5",
        "source": "workflow:researcher",
        "statement": "Researcher stage workflow execution verified",
        "provenance": "backend/agents/researcher/workflow.ts"
      },
      {
        "evidence_id": "evidence:planner-build-001:6",
        "source": "tavily:answer:a2e9a3c1-c742-4f2a-9124-2425dcbf73b1",
        "statement": "The production‑ready build plan for the Planner agent begins by defining a modular research structure that leverages the Strands Agents SDK to generate dynamic, prompt‑driven workflows and the Tavily API to provide secure, real‑time web search, high‑fidelity content extraction, and structured crawling, allowing the agent to ingest and synthesize external data on demand; an audit‑findings contract is codified as a canonical JSON schema that records each audit item’s identifier, description, severity, source, validation status, and remediation actions, and this schema is embedded in a dependency‑graph validator that constructs a directed‑acyclic graph (DAG) of task and data dependencies to ensure that all prerequisite nodes are satisfied before execution, while the planner’s loop integration is refactored to map Loop‑generated tasks into a single centralized Microsoft Planner plan, preserving hierarchical relationships (main task‑subtask) and synchronizing status across Grid and Kanban views; the execution design includes a handoff layer that translates Loop task payloads into the Planner‑compatible schema, enforces DAG validation, triggers Strands‑driven reasoning steps, invokes Tavily for web enrichment, and records results back into the audit schema, with production safeguards such as rate‑limiting, retry policies, observability hooks, and automated CI/CD pipelines to validate schema changes, dependency integrity, and end‑to‑end functional correctness before each release.",
        "provenance": "tavily-search-answer:a2e9a3c1-c742-4f2a-9124-2425dcbf73b1"
      },
      {
        "evidence_id": "evidence:planner-build-001:7",
        "source": "https://aws.amazon.com/blogs/machine-learning/build-dynamic-web-research-agents-with-the-strands-agents-sdk-and-tavily",
        "statement": "Build dynamic web research agents with the Strands Agents SDK and Tavily | Artificial Intelligence\n## Tavily: Secure, modular web intelligence for AI agents\n\nTavily is an API-first web intelligence layer designed specifically for LLM agents, powering real-time search, high-fidelity content extraction, and structured web crawling. Built for developers building AI-based systems, Tavily is engineered for precision, speed, and modularity. It offers a seamless integration experience for agent frameworks like Strands Agents.Tavily’s API is an enterprise-grade infrastructure layer trusted by leading AI companies. It combines robust capabilities with production-grade operational guarantees, such as: [...] ## Research agent example\n\nMany research agent implementations require extensive development efforts and rely on deterministic logic or workflows with constrained inputs and outputs. Alternatively, Strands enables developers to build highly dynamic agents through natural language. Strands agents use prompt engineering to dynamically generate varied output types and accept diverse natural language inputs seamlessly.Combining Tavily with Strands unlocks a new class of agents purpose-built for deep, dynamic research. Unlike hardcoded research pipelines, this pairing helps developers accomplish the following: [...] ```",
        "provenance": "tavily-search:a2e9a3c1-c742-4f2a-9124-2425dcbf73b1:https://aws.amazon.com/blogs/machine-learning/build-dynamic-web-research-agents-with-the-strands-agents-sdk-and-tavily"
      },
      {
        "evidence_id": "evidence:planner-build-001:8",
        "source": "https://techcommunity.microsoft.com/discussions/planner/planner-integration-with-loop-tasks/4465839",
        "statement": "Planner Integration with Loop Tasks\nWhen using Loop, and we create a task and we connect it to Planner, it will create a new Plan and put the tasks under that. To me, this is dysfunctional, because we want all tasks to be under the main Plan in Planner. I like to use the GRID view of the Plan, which enables me to make subtasks under the main tasks, but others prefer to use the kanban view. However you can't see the subtasks that are under the \"main task\" like in Grid view.\n\nThere's lots of videos showing how these parts of Teams work together, but in reality, it doesn't really work that well when it scatters tasks created in different parts to different Planners.\n\nAny suggestions would be helpful, and thank you in advance for your help.\n\nJim\n\nloop\n\nplanner",
        "provenance": "tavily-search:a2e9a3c1-c742-4f2a-9124-2425dcbf73b1:https://techcommunity.microsoft.com/discussions/planner/planner-integration-with-loop-tasks/4465839"
      },
      {
        "evidence_id": "evidence:planner-build-001:9",
        "source": "https://dev.to/aws/building-production-ready-ai-agents-with-strands-agents-and-amazon-bedrock-agentcore-3dg0",
        "statement": "Building Production-Ready AI Agents with Strands Agents and Amazon Bedrock AgentCore - DEV Community\n``` [...] ``` [...] ```",
        "provenance": "tavily-search:a2e9a3c1-c742-4f2a-9124-2425dcbf73b1:https://dev.to/aws/building-production-ready-ai-agents-with-strands-agents-and-amazon-bedrock-agentcore-3dg0"
      },
      {
        "evidence_id": "evidence:planner-build-001:10",
        "source": "https://aws-news.com/article/2025-07-31-build-dynamic-web-research-agents-with-the-strands-agents-sdk-and-tavily",
        "statement": "Build dynamic web research agents with the Strands Agents ...\nThis article introduces a powerful collaboration between Strands Agents SDK and Tavily, enabling developers to build dynamic web research",
        "provenance": "tavily-search:a2e9a3c1-c742-4f2a-9124-2425dcbf73b1:https://aws-news.com/article/2025-07-31-build-dynamic-web-research-agents-with-the-strands-agents-sdk-and-tavily"
      },
      {
        "evidence_id": "evidence:planner-build-001:11",
        "source": "https://www.snowflake.com/en/developers/guides/build-a-due-diligence-and-investment-research-agent-in-snowflake-using-tavily",